{
  "capability": "manuscript-writing",
  "task_sha256": "90272088f3c8caf3ebac0281b97e56ce80d10879e227a6bb01f19da5c23f5d80",
  "provider_id": "host_fallback",
  "execution_mode": "host_fallback",
  "execution_status": "executed",
  "outputs": [
    {
      "path": "draft.md",
      "sha256": "d376aba0065e46083e1d9d4012d1b59b0ebe73c48589ef4c6b25b9addf405114",
      "role": "draft"
    }
  ],
  "result_links": {
    "kind": "result-links",
    "sources": [
      {
        "id": "frozen",
        "path": "results.json",
        "versions": {
          "data": {
            "path": "measurements.json",
            "sha256": "f8357cdd2c69e65a9f2f6f20a70df503b2634df533bef05d727a955e416497cf"
          },
          "code": {
            "path": "compute.py",
            "sha256": "e2efbabe81c32766b1938f14672c9c0686924e24a0535031fdc1183897156d63"
          },
          "execution": {
            "path": "execution.json",
            "sha256": "13edf7a430264728672c8022ec84d52279df945bb28aec125c562425c207bc29"
          }
        },
        "sha256": "82632f36cf1e5f09ce15ce7a6d7263dffc499aac81d9c1da51cd8b19f23a97b8"
      }
    ],
    "links": [
      {
        "result_id": "R-latency",
        "source_id": "frozen",
        "role": "body",
        "artifact": {
          "path": "draft.md",
          "sha256": "d376aba0065e46083e1d9d4012d1b59b0ebe73c48589ef4c6b25b9addf405114"
        },
        "locator": {
          "line": 1
        },
        "semantics": {
          "unit": {
            "value": "ms",
            "text": "ms"
          },
          "direction": {
            "value": "decrease",
            "text": "lower"
          },
          "denominator": {
            "value": 4,
            "text": "n=4"
          },
          "outcome": {
            "value": "latency",
            "text": "latency"
          },
          "population": {
            "value": "digital instances",
            "text": "digital instances"
          },
          "time": {
            "value": "6.25",
            "text": "6.25"
          },
          "comparison": {
            "value": "Solver baseline",
            "text": "Solver baseline"
          },
          "model": {
            "value": "solver-a",
            "text": "Solver A"
          },
          "implementation": {
            "value": "loop",
            "text": "loop"
          },
          "split": {
            "value": "holdout",
            "text": "holdout"
          },
          "uncertainty": {
            "value": "0.95",
            "text": "0.95"
          },
          "effect_type": {
            "value": "absolute mean",
            "text": "absolute mean"
          }
        },
        "numeric": [
          {
            "field": "value",
            "decimals": 1,
            "text": "410.0"
          },
          {
            "field": "lower",
            "decimals": 1,
            "text": "390.0"
          },
          {
            "field": "upper",
            "decimals": 1,
            "text": "430.0"
          }
        ]
      }
    ],
    "claims": []
  }
}
